{"ambiguities":[],"applicationId":"new-idea","confirmation":{"confirmedFactIds":[],"delegatedDefaultFactIds":[],"ideaEntryId":null,"state":"not-requested"},"entities":[],"facts":[{"id":"builder-public-idea","kind":"unconfirmed-builder-idea","materiality":"core","modality":"desired","payloadSchema":{"byteLength":null,"kind":"builtin","path":null,"schemaId":"urn:programmable:builtin:draft:unconfirmed:1.0.0","sha256":null},"plainLanguage":{"language":"und","text":"Replace this public-safe placeholder with the builder's exact idea before review."},"provenance":[{"endByte":81,"ideaEntryId":"original-idea","legacySourceRef":null,"relation":"direct","startByte":0}],"semanticPayload":{"publicIdeaSha256":"sha256:3b70b9fb87e29a0e44c01e131703631d5cbe123d9bfe559d94891b415a54c45a","status":"unconfirmed"},"state":"unresolved","subjectRefs":[]}],"ideaSourceSha256":"sha256:01842c17ccb2851bbd3d88b9ce1cf0990656d17456d776992b6213cccf7b2d33","revision":1,"route":{"blockedByRefs":["builder-public-idea"],"id":"CUSTOM_ARCHITECTURE","reasons":[{"language":"en","text":"The builder idea is captured, but its architecture has not been interpreted or confirmed yet."}]},"schemaVersion":"1.0.0","status":"draft","workingLanguage":"und"}
